FONTE,TIPO,ID_LATTES,NOME,DOI,TITULO,ANO,LANG,EVENTO/JOURNAL/LIVRO,CIDADE_EVENTO,ANO_EVENTO,AUTORES
LATTES,PERIODICO,9940289333509769,Vania Elisabete Schneider,,Avaliação das condições de manejo dos resíduos sólidos de serviços de saúde em um ambulatório,1998,Português,Revista do Hospital de Clínicas de Porto Alegre,SEM_DADOS,SEM_DADOS,"['MICHIELIN, T. L. and', 'MANDELLI, S. M. C. and', 'STÉDILLE, Nilva Lúcia Rech and', 'GASTALDELLO, Maria Eugênia Turra and', 'PESSIN, Neide and', 'CLAUS, S. and', 'SCHNEIDER, V. E.;Schneider, Vania Elisabete;Vânia Schneider;SCHNEIDER, V.;Vania Elisabete Schneider;ELISABETE SCHNEIDER, VANIA;SCHNEIDER, V.E.;SCHNEIDER, VANIA;SCHNEIDER, V E;Vania Eliasabete Schneider and']"
LATTES,PERIODICO,9940289333509769,Vania Elisabete Schneider,,Análise da eficiência do processo via esterilização por vapor úmido e alto vácuo associado a microondas em um estabelecimento hospitalar,2001,Português,Gerenciamento Ambiental,SEM_DADOS,SEM_DADOS,"['ORLANDIN, Sandra Maria and', 'SCHNEIDER, V. E.;Schneider, Vania Elisabete;Vânia Schneider;SCHNEIDER, V.;Vania Elisabete Schneider;ELISABETE SCHNEIDER, VANIA;SCHNEIDER, V.E.;SCHNEIDER, VANIA;SCHNEIDER, V E;Vania Eliasabete Schneider and']"
LATTES,PERIODICO,9940289333509769,Vania Elisabete Schneider,,Tratamento de material de serviços de saúde,2001,Português,Saneamento Ambiental,SEM_DADOS,SEM_DADOS,"['ORLANDIN, Sandra Maria and', 'SCHNEIDER, V. E.;Schneider, Vania Elisabete;Vânia Schneider;SCHNEIDER, V.;Vania Elisabete Schneider;ELISABETE SCHNEIDER, VANIA;SCHNEIDER, V.E.;SCHNEIDER, VANIA;SCHNEIDER, V E;Vania Eliasabete Schneider and']"
LATTES,PERIODICO,9940289333509769,Vania Elisabete Schneider,,Melhorando a produtividade com o planejamento e o controle da produção,2006,Português,Plástico Industrial,SEM_DADOS,SEM_DADOS,"['PAVONI, Elóide Teresa and', 'HILLIG, Éverton and', 'SCHNEIDER, V. E.;Schneider, Vania Elisabete;Vânia Schneider;SCHNEIDER, V.;Vania Elisabete Schneider;ELISABETE SCHNEIDER, VANIA;SCHNEIDER, V.E.;SCHNEIDER, VANIA;SCHNEIDER, V E;Vania Eliasabete Schneider and']"
LATTES,PERIODICO,9940289333509769,Vania Elisabete Schneider,,Kestääkö sohva?,2006,Finlandês,Aurinkolaiva,SEM_DADOS,SEM_DADOS,"['SCHNEIDER, V. E.;Schneider, Vania Elisabete;Vânia Schneider;SCHNEIDER, V.;Vania Elisabete Schneider;ELISABETE SCHNEIDER, VANIA;SCHNEIDER, V.E.;SCHNEIDER, VANIA;SCHNEIDER, V E;Vania Eliasabete Schneider and', 'PENTTINEN, Ilpo and']"
LATTES,PERIODICO,9940289333509769,Vania Elisabete Schneider,,Avaliação dos impactos ambientais e econômicos nos sistemas de coleta seletiva e regular no Município de Bento Gonçalves,2006,Português,Revista Limpeza Pública,SEM_DADOS,SEM_DADOS,"['SCHNEIDER, V. E.;Schneider, Vania Elisabete;Vânia Schneider;SCHNEIDER, V.;Vania Elisabete Schneider;ELISABETE SCHNEIDER, VANIA;SCHNEIDER, V.E.;SCHNEIDER, VANIA;SCHNEIDER, V E;Vania Eliasabete Schneider and', 'FINOTTI, Alexandra Rodrigues and', 'PANAROTTO, Cláudia Teixeira and', 'PERESIN, D. and']"
LATTES,PERIODICO,9940289333509769,Vania Elisabete Schneider,,"Modelagem de misturas na fabricação de compósitos polímero- fibra, utilizando polietileno e serragem de Pinus sp.",2006,Português,Ciência Florestal (UFSM. Impresso),SEM_DADOS,SEM_DADOS,"['HILLIG, Éverton and', 'FREIRE, Estevão and', 'CARVALHO, Gláucio de Almeida and', 'SCHNEIDER, V. E.;Schneider, Vania Elisabete;Vânia Schneider;SCHNEIDER, V.;Vania Elisabete Schneider;ELISABETE SCHNEIDER, VANIA;SCHNEIDER, V.E.;SCHNEIDER, VANIA;SCHNEIDER, V E;Vania Eliasabete Schneider and', 'POCAI, Karla and']"
LATTES,PERIODICO,9940289333509769,Vania Elisabete Schneider,,Gerenciamento Integrado de resíduos rurais e sua interface com a gestão ambiental: Panorama da situação na região de abrangência do COREDE Serra,2007,Português,Revista Limpeza Pública,SEM_DADOS,SEM_DADOS,"['SCHNEIDER, V. E.;Schneider, Vania Elisabete;Vânia Schneider;SCHNEIDER, V.;Vania Elisabete Schneider;ELISABETE SCHNEIDER, VANIA;SCHNEIDER, V.E.;SCHNEIDER, VANIA;SCHNEIDER, V E;Vania Eliasabete Schneider and', 'FINOTTI, Alexandra Rodrigues and', ""SILVA, Mauricio D'agostini and"", 'CEMIN, Gisele and', 'PERESIN, D. and']"
LATTES,PERIODICO,9940289333509769,Vania Elisabete Schneider,10.1590/S0103-65132009000200006,Geração de resíduos de madeira e derivados da indústria moveleira em função das variáveis de produção,2009,Inglês,Produção (São Paulo. Impresso),SEM_DADOS,SEM_DADOS,"['HILLIG, Éverton and', 'SCHNEIDER, V. E.;Schneider, Vania Elisabete;Vânia Schneider;SCHNEIDER, V.;Vania Elisabete Schneider;ELISABETE SCHNEIDER, VANIA;SCHNEIDER, V.E.;SCHNEIDER, VANIA;SCHNEIDER, V E;Vania Eliasabete Schneider and', 'Pavoni, Eloide Teresa and']"
LATTES,PERIODICO,9940289333509769,Vania Elisabete Schneider,,Análise comparativa dos custos ambientais relacionados ao gerenciamento dos RSS em dois horpitais da Região da Serra Gaúcha - Brasil,2008,Português,Revista AIDIS de Ingeniería y Ciencias Ambientales,SEM_DADOS,SEM_DADOS,"['SCHNEIDER, V. E.;Schneider, Vania Elisabete;Vânia Schneider;SCHNEIDER, V.;Vania Elisabete Schneider;ELISABETE SCHNEIDER, VANIA;SCHNEIDER, V.E.;SCHNEIDER, VANIA;SCHNEIDER, V E;Vania Eliasabete Schneider and', 'BEN, Fernando and', 'CARVALHO, Aline Brum de and']"
LATTES,PERIODICO,9940289333509769,Vania Elisabete Schneider,,Proposta metodológica para a elaboração de um Zoneamento Ambiental,2012,Português,RBC. Revista Brasileira de Cartografia (Online),SEM_DADOS,SEM_DADOS,"['CEMIN, Gisele and', 'SCHNEIDER, V. E. and', 'PERICO, E. and', 'FINOTTI, A. R. and']"
LATTES,PERIODICO,9940289333509769,Vania Elisabete Schneider,,"Determinação da perda de solos por erosão laminar na bacia hidrográfica do arroio Marrecas, RS, Brasil",2013,Português,Scientia Plena,SEM_DADOS,SEM_DADOS,"['CEMIN, Gisele and', 'SCHNEIDER, V. E. and', 'PERICO, E. and', 'FINOTTI, A. R. and']"
LATTES,PERIODICO,9940289333509769,Vania Elisabete Schneider,10.14295/ras.v27i1.27061,CARACTERIZAÇÃO HIDROQUÍMICA DO SISTEMA AQUÍFERO SERRA GERAL NA REGIÃO NORDESTE DO RIO GRANDE DO SUL,2013,Português,Águas Subterrâneas,SEM_DADOS,SEM_DADOS,"['REGINATTO, Pedro Antônio Roehe and', 'AHLERT, S. and', 'SCHNEIDER, V. E. and']"
LATTES,PERIODICO,9940289333509769,Vania Elisabete Schneider,,Sistema de Informações Gerenciais (SIG): Ferramenta de Monitoramento do Gerenciamento de Resíduos de Serviços de Saúde (RSS) e dos Custos de Tratamento,2013,Português,Revista de Gestao Ambiental e Sustentabilidade,SEM_DADOS,SEM_DADOS,"['SCHNEIDER, V. E.;Schneider, Vania Elisabete;Vânia Schneider;SCHNEIDER, V.;Vania Elisabete Schneider;ELISABETE SCHNEIDER, VANIA;SCHNEIDER, V.E.;SCHNEIDER, VANIA;SCHNEIDER, V E;Vania Eliasabete Schneider and', 'STEDILE, N. L. R. and', 'BIGOLIN, M and', 'PAIZ, J. C. and']"
LATTES,PERIODICO,9940289333509769,Vania Elisabete Schneider,10.18226/23185279.v1iss1p19,Gestão ambiental de resíduos em um Hospital Escola e em um Laboratório de Anatomia Humana de uma Universidade,2013,Português,Scientia cum Industria,SEM_DADOS,SEM_DADOS,"['Schneider, Vania Elisabete and', 'MANFREDINI, K. L. and', 'Nascimento, I. F. and']"
LATTES,PERIODICO,9940289333509769,Vania Elisabete Schneider,10.4136/ambi-agua.1270,Hidrogeologia e hidroquímica dos aquíferos fraturados associados às rochas vulcânicas ácidas no Município de Carlos Barbosa (RS),2014,Português,Revista Ambiente &amp; Água,SEM_DADOS,SEM_DADOS,"['Bortolin, T. A. and', 'REGINATTO, Pedro Antônio Roehe and', 'Leão, M. I. and', 'SCHNEIDER, V. E. and']"
LATTES,PERIODICO,9940289333509769,Vania Elisabete Schneider,10.1590/0104-1169.3309.2499,Applying Nightingale charts to evaluate the heterogeneity of biomedical waste in a Hospital,2014,Inglês,Revista Latino-Americana de Enfermagem,SEM_DADOS,SEM_DADOS,"['PAIZ, J. C. and', 'STEDILE, N. L. R. and', 'SCHNEIDER, V. E. and']"
LATTES,PERIODICO,9940289333509769,Vania Elisabete Schneider,10.5380/dma.v33i0.36413,Cobrança pelo uso da água no Brasil: uma revisão metodológica,2015,Português,Desenvolvimento e Meio Ambiente (UFPR),SEM_DADOS,SEM_DADOS,"['FINKLER, N. R. and', 'MENDES, L. A. and', 'Bortolin, T. A. and', 'SCHNEIDER, V. E. and']"
LATTES,PERIODICO,9940289333509769,Vania Elisabete Schneider,10.5007/2175-7941.2014v31n3p677,Levando água à ebulição à temperatura ambiente?,2014,Português,Caderno Brasileiro de Ensino de Física (Online),SEM_DADOS,SEM_DADOS,"['CATELLI, F. and', 'BARBIERI, R. and', 'SCHNEIDER, V. E. and']"
LATTES,PERIODICO,9940289333509769,Vania Elisabete Schneider,,Development of a monitoring network of water resources in urban areas as a support for municipal environmental management,2014,Português,WIT Transactions on Ecology and the Environment (Online),SEM_DADOS,SEM_DADOS,"['FINOTTI, A. R. and', 'FINKLER, Raquel and', 'SUSIN, N. and', 'Schneider, Vania Elisabete and', ""SILVA, Mauricio D'agostini and""]"
LATTES,PERIODICO,9940289333509769,Vania Elisabete Schneider,,"Estimativa do Potencial de Geração de Biomassa, Metano e Energia pelas principais criações pecuárias do Brasil",2015,Português,Revista AIDIS de Ingeniería y Ciencias Ambientales,SEM_DADOS,SEM_DADOS,"['PERESIN, D. and', 'BORTOLIN, T. A. and', 'TRENTIM, A. C. and', 'COCCONI, J. and', 'SCHNEIDER, V. E.;Schneider, Vania Elisabete;Vânia Schneider;SCHNEIDER, V.;Vania Elisabete Schneider;ELISABETE SCHNEIDER, VANIA;SCHNEIDER, V.E.;SCHNEIDER, VANIA;SCHNEIDER, V E;Vania Eliasabete Schneider and']"
LATTES,PERIODICO,9940289333509769,Vania Elisabete Schneider,10.1007/s12665-014-3823-3,"Morphometric evaluation of watersheds in Caxias do Sul City, Brazil, using SRTM (DEM) data and GIS",2014,Inglês,Environmental Earth Sciences (Print),SEM_DADOS,SEM_DADOS,"['VIECELI, NATHÁLIA and', 'BORTOLIN, TAISON ANDERSON and', 'MENDES, LUDMILSON ABRITTA and', 'BACARIM, GISELE and', 'CEMIN, Gisele and', 'Schneider, Vania Elisabete and']"
LATTES,PERIODICO,9940289333509769,Vania Elisabete Schneider,,"Ecoturismo: potencialidades e limitações ambientais do município de São José dos Ausentes, RS",2015,Português,Rosa dos Ventos,SEM_DADOS,SEM_DADOS,"['CASAGRANDE, V. and', 'Schneider, Vania Elisabete and', 'CEMIN, Gisele and', 'BORTOLIN, TAISON ANDERSON and']"
LATTES,PERIODICO,9940289333509769,Vania Elisabete Schneider,10.5902/2179460X18168,SPATIAL AND TEMPORAL ASSESSMENT OF WATER QUALITY DATA USING MULTIVARIATE STATISTICAL TECHNIQUES,2016,Português,Ciência e Natura,SEM_DADOS,SEM_DADOS,"['FINKLER, N. R. and', 'MENDES, L. A. and', 'COCCONI, J. and', 'Bortolin, T. A. and', 'SCHNEIDER, V. E. and']"
LATTES,PERIODICO,9940289333509769,Vania Elisabete Schneider,10.18226/23185279.v3iss2p42,Comparação de funções de distribuição de probabilidades na determinação de vazão mínima anual e sazonal,2015,Português,SCIENTIA CUM INDUSTRIA,SEM_DADOS,SEM_DADOS,"['FINKLER, N. R. and', 'MENDES, L. A. and', 'SCHNEIDER, E. H. M. and', 'Bortolin, T. A. and', 'SCHNEIDER, V. E. and']"
LATTES,PERIODICO,9940289333509769,Vania Elisabete Schneider,10.4136/ambi-agua.1468,Qualidade da água superficial por meio de análise do componente principal,2015,Português,Revista Ambiente &amp; Água,SEM_DADOS,SEM_DADOS,"['FINKLER, N. R. and', 'PERESIN, D. and', 'COCCONI, J. and', 'Taison A. Bortolin and', 'RECH, A. and', 'SCHNEIDER, V. E. and']"
LATTES,PERIODICO,9940289333509769,Vania Elisabete Schneider,10.18226/23185279.v3iss2p55,Pegada Hídrica Cinza dos Suínos Abatidos no Corede Serra/RS - Brasil,2015,Português,Scientia cum Industria,SEM_DADOS,SEM_DADOS,"['HELENA ZANELLA CARRA, SOFIA and', 'ELISABETE SCHNEIDER, VANIA and']"
LATTES,PERIODICO,9940289333509769,Vania Elisabete Schneider,10.6008/SPC2179-6858.2016.001.0022,Comparison between the municipal solid waste management of two municipalities from mountain region,2016,Inglês,Revista Ibero-americana de Ciências Ambientais,SEM_DADOS,SEM_DADOS,"['PERESIN, D. and', 'FINKLER, N. R. and', 'GRANDO, M. R. and', 'CASAGRANDE, V. and', 'Tonet, E. M. and', 'Schneider, Vania Elisabete and']"
LATTES,PERIODICO,9940289333509769,Vania Elisabete Schneider,10.4136/ambi-agua.1688,"Pegada hídrica dos suínos abatidos na região do Corede Serra, RS, Brasil",2016,Português,Revista Ambiente e Agua,SEM_DADOS,SEM_DADOS,"['SCHNEIDER, V. and', 'Carra. S. H. Z. and']"
LATTES,PERIODICO,9940289333509769,Vania Elisabete Schneider,10.18226/23185279.v3iss1p1,Potential for attenuation of a stream in a subtropical region - Rio Grande do Sul - Brazil,2015,Inglês,Scientia cum Industria,SEM_DADOS,SEM_DADOS,"['PERESIN, D. and', 'VIECELI, N. C. and', 'BORTOLIN, T. A. and', 'BAVARESCO, G. and', 'SCHNEIDER, V. E.;Schneider, Vania Elisabete;Vânia Schneider;SCHNEIDER, V.;Vania Elisabete Schneider;ELISABETE SCHNEIDER, VANIA;SCHNEIDER, V.E.;SCHNEIDER, VANIA;SCHNEIDER, V E;Vania Eliasabete Schneider and']"
LATTES,PERIODICO,9940289333509769,Vania Elisabete Schneider,10.18226/23185279.v4iss1p1,Análise da Influência do Uso e Ocupação do Solo na Qualidade da Água de Duas Sub-Bacias Hidrográficas do Município de Caxias do Sul,2016,Português,Scientia cum Industria,SEM_DADOS,SEM_DADOS,"['CORNELLI, Renata and', 'ELISABETE SCHNEIDER, VANIA and', 'ANDERSON BORTOLIN, TAISON and', 'CEMIN, Gisele and', 'MACEDO DOS SANTOS, GEISE and']"
LATTES,PERIODICO,9940289333509769,Vania Elisabete Schneider,10.4090/juee.2016.v10n1.050056,URBAN SOLID WASTE MANAGEMENT IN CAXIAS DO SUL/BRAZIL: PRACTICES AND CHALLENGES,2016,Inglês,Journal of Urban and Environmental Engineering (UFPB),SEM_DADOS,SEM_DADOS,"['POLETTO, Matheus and', 'MORI, Paulo Rogério de and', 'SCHNEIDER, V. E. and', 'ZATTERA, A. J. and']"
LATTES,PERIODICO,9940289333509769,Vania Elisabete Schneider,10.14295/ras.v30i1.28585,Relação entre Padrões Hidroquímicos e as Profundidades das Entradas de Água de Aquíferos Fraturados Associados às Rochas Vulcânicas Ácidas da Formação Serra Geral,2016,Português,Águas Subterrâneas,SEM_DADOS,SEM_DADOS,"['Taison A. Bortolin and', 'REGINATTO, Pedro Antônio Roehe and', 'Leão, M. I. and', 'SCHNEIDER, V. E. and']"
LATTES,PERIODICO,9940289333509769,Vania Elisabete Schneider,10.1590/s1413-41522017142636,Avaliação da geração de resíduos de equipamentos eletroeletrônicos (REEEs) em uma universidade particular,2017,Português,Engenharia Sanitaria e Ambiental,SEM_DADOS,SEM_DADOS,"['Panizzon, T. and', 'REICHERT, Geraldo Antônio and', 'SCHNEIDER, V. E. and']"
LATTES,PERIODICO,9940289333509769,Vania Elisabete Schneider,,Capacitação em recursos hídricos por meio de oficinas temáticas e AVA: proposta metodológica,2016,Português,Revista EDaPECI: Educação a Distância e Práticas Educativas Comunicacionais e Interculturais,SEM_DADOS,SEM_DADOS,"['BACARIM, G. and', 'SCHNEIDER, V. E.;Schneider, Vania Elisabete;Vânia Schneider;SCHNEIDER, V.;Vania Elisabete Schneider;ELISABETE SCHNEIDER, VANIA;SCHNEIDER, V.E.;SCHNEIDER, VANIA;SCHNEIDER, V E;Vania Eliasabete Schneider and', 'SAUER, L. T. Z. and']"
LATTES,PERIODICO,9940289333509769,Vania Elisabete Schneider,,"Cluster formation of potencial assessment for swine manute treatment and biogas generation in an experimental watershed in Rio Grande do Sul, Brazil",2016,Inglês,WIT Transactions on Ecology and the Environment,SEM_DADOS,SEM_DADOS,"['SCHNEIDER, V. E.;Schneider, Vania Elisabete;Vânia Schneider;SCHNEIDER, V.;Vania Elisabete Schneider;ELISABETE SCHNEIDER, VANIA;SCHNEIDER, V.E.;SCHNEIDER, VANIA;SCHNEIDER, V E;Vania Eliasabete Schneider and', 'ZANONI, N. and', 'CARRA, S. H. Z. and']"
LATTES,PERIODICO,9940289333509769,Vania Elisabete Schneider,10.1590/1413-812320182311.19352016,A Aplicação do Modelo FPSSEA no Gerenciamento de Resíduos de Serviço de Saúde,2018,Português,Ciência &amp; Saúde Coletiva,SEM_DADOS,SEM_DADOS,"['STEDILE, N. L. R. and', 'SCHNEIDER, V. E. and']"
LATTES,PERIODICO,9940289333509769,Vania Elisabete Schneider,10.21577/0100-4042.20160180,DETERMINAÇÃO DE AGROTÓXICOS NA ÁGUA E SEDIMENTOS POR HPLC-HRMS E SUA RELAÇÃO COM O USO E OCUPAÇÃO DO SOLO,2016,Português,Química Nova (Online),SEM_DADOS,SEM_DADOS,"['Chierello, M. and', 'GRAEF, R. E. N. and', 'MINETO, L and', 'CEMIN, G. and', 'SCHNEIDER, V. E. and', 'SILVA, S. M. and']"
LATTES,PERIODICO,9940289333509769,Vania Elisabete Schneider,10.1007/s10661-016-5635-2,"Monitoring and assessment of surface water quality in Taquari-Antas Watershed, South Brazil: region with intensive pig farming",2016,Português,Environmental Monitoring and Assessment (Dordrecht. Online),SEM_DADOS,SEM_DADOS,"['SCHNEIDER, V. and', 'MARQUES, R. V. and', 'BORTOLIN, T. A. and', 'CEMIN, G. and', 'SANTOS, G. M. and']"
LATTES,PERIODICO,9940289333509769,Vania Elisabete Schneider,10.18226/23185279.v4iss2p125,Análise da situação ambiental das Áreas de Preservação Permanente no município de São José dos Ausentes - RS,2016,Português,Scientia cum Industria,SEM_DADOS,SEM_DADOS,"['ELISABETE SCHNEIDER, VANIA and', 'BREZOLIN MAGRIN, TATIANA and', 'CEMIN, Gisele and', 'MACEDO DOS SANTOS, GEISE and']"
LATTES,PERIODICO,9940289333509769,Vania Elisabete Schneider,10.2495/SDP-V10-N6-781-794,Use of water quality index as a tool for urban water resources management,2015,Inglês,International Journal of Sustainable Development and Planning: encouraging the unified approach to achieve sustainability,SEM_DADOS,SEM_DADOS,"['FINOTTI, A.R. and', 'FINKLER, R. and', 'SUSIN, N. and', 'SCHNEIDER, V.E. and']"
LATTES,PERIODICO,9940289333509769,Vania Elisabete Schneider,10.18226/23185279.v4iss2p103,Critérios De Usabilidade Em Processo De Migração De Biblioteca Gráfica Em Um Sistema De Informações Ambientais,2016,Português,Scientia cum Industria,SEM_DADOS,SEM_DADOS,"['SCHNEIDER, VANIA and', 'SPIANDORELLO, ROBERTO and', 'GIORDANI, MIGUEL and', 'HOFFMANN, GUILHERME and', 'GRACIOLLI, ODACIR and']"
LATTES,PERIODICO,9940289333509769,Vania Elisabete Schneider,,"Análise da influência turística sobre o comportamento dos peixes no rio Olho D?água, Jardim, Mato Grosso do Sul",2017,Português,REVISTA BRASILEIRA DE ECOTURISMO,SEM_DADOS,SEM_DADOS,"['Bilha, A. A. and', 'SCHNEIDER, V. E. and', 'ESTERQUILE JUNIOR, O. and']"
LATTES,PERIODICO,9940289333509769,Vania Elisabete Schneider,10.1088/1755-1315/78/1/012011,Evaluation of the Efficiency of Selective Collection in a Small Town on the State of Rio Grande do Sul - Brazil,2017,Português,IOP Conference Series: Earth and Environmental Science,SEM_DADOS,SEM_DADOS,"['SCHNEIDER, V E and', 'POLETTO, M and', 'PERESIN, D and', 'CARRA, S H Z and', 'VANNI, D and']"
LATTES,PERIODICO,9940289333509769,Vania Elisabete Schneider,,A utilização do método de Aprendizagem Baseada em Problemas para conhecer e desenvolver hábitos de consumo consciente da energia elétrica no Ensino Fundamental,2017,Português,Revista Interdisciplinar de Ciência Aplicada,SEM_DADOS,SEM_DADOS,"['LEITE, F. F. and', 'CUNHA, G. F. and', 'SCHNEIDER, V. E. and']"
LATTES,PERIODICO,9940289333509769,Vania Elisabete Schneider,,Evaluation of metal bioavailability in the Tega River watershed sediments in Southern Brazil,2017,Português,Journal of Environment and Biotechnology Research,SEM_DADOS,SEM_DADOS,"['SCHMITZ, M. and', 'GIOVANELA, M. and', 'SCHNEIDER, V. E. and']"
LATTES,PERIODICO,9940289333509769,Vania Elisabete Schneider,10.18226/23185279.v5iss1p10,Boas práticas em gestão ambiental de Instituições de Ensino Superior: o caso da Universidade de Turku de Ciências Aplicadas,2017,Português,SCIENTIA CUM INDUSTRIA,SEM_DADOS,SEM_DADOS,"['MARINA TONET MOTTA, ELIS and', 'ELISABETE SCHNEIDER, VANIA and', 'RODRIGUES GIMENEZ, JULIANO and', 'KAIRISTO-MERTANEN, LIISA and']"
LATTES,PERIODICO,9940289333509769,Vania Elisabete Schneider,10.2495/ei-v1-n3-298-311,Water quality monitoring in urban basins as support for water resources management: A case study from southern brazil,2018,Inglês,"International Journal of Environmental Impacts: Management, Mitigation and Recovery",SEM_DADOS,SEM_DADOS,"['FINKLER, N. R. and', 'COCCONI, J. and', 'Taison A. Bortolin and', 'MENDES, L. A. and', 'SCHNEIDER, V. E. and']"
LATTES,PERIODICO,9940289333509769,Vania Elisabete Schneider,,José Carlos Köche: uma vida com a UCS,2017,Português,Revista Interdisciplinar de Ciência Aplicada,SEM_DADOS,SEM_DADOS,"['SANTIN, M. A. and', 'SCHNEIDER, V. E. and', 'CUNHA, G. F. and']"
LATTES,PERIODICO,9940289333509769,Vania Elisabete Schneider,,Educação Ambiental e Iniciação Científica no Ensino Fundamental,2017,Português,REVISTA ELETRÔNICA ENGENHARIA VIVA,SEM_DADOS,SEM_DADOS,"['CARMINATTI, A. F. and', 'SCHNEIDER, V. E. and']"
LATTES,PERIODICO,9940289333509769,Vania Elisabete Schneider,,Environmental Strategy of Universities of Southern Brazil,2017,Português,WIT TRANSACTIONS ON ECOLOGY AND THE ENVIRONMENT (PRINT),SEM_DADOS,SEM_DADOS,"['Tonet, E. M. and', 'GIMENEZ, J. R. and', 'SCHNEIDER, V. E. and']"
LATTES,PERIODICO,9940289333509769,Vania Elisabete Schneider,10.2166/wh.2017.144,Assessment of diversity of adenovirus DNA polimerase gene in recreational waters facilitated by ultracentrifugal concentration,2017,Português,JOURNAL OF WATER AND HEALTH,SEM_DADOS,SEM_DADOS,"['GIRARDI, VIVIANE and', 'DEMOLINER, MERIANE and', 'RIGOTTO, CAROLINE and', 'Schneider, Vania Elisabete and', 'PAESI, SUELEN and', 'SPILKI, FERNANDO ROSADO and']"
LATTES,PERIODICO,9940289333509769,Vania Elisabete Schneider,,Uso e cobertura do solo nos arredores das Unidades de Conservação Ambiental no Município de Cambará,2017,Português,REVISTA BRASILEIRA DE ECOTURISMO,SEM_DADOS,SEM_DADOS,"['SANTOS, G. M. and', 'CEMIN, G. and', 'MAGRIN, T. B. and', 'SCHNEIDER, V. E. and']"
LATTES,PERIODICO,9940289333509769,Vania Elisabete Schneider,10.18226/23185279.v3iss3p127a,Brincando de Geneticista: Descobrindo o DNA e Desvendando o que Esta por trás do Cariótipo Humano,2015,Português,SCIENTIA CUM INDUSTRIA,SEM_DADOS,SEM_DADOS,"['POSTAY LOSQUIAVO, KAMILLE and', 'COULON GRISA, ANA MARIA and', 'Schneider, Vania Elisabete and']"
LATTES,PERIODICO,9940289333509769,Vania Elisabete Schneider,10.18226/23185279.v6iss2p15,Monitoring of an urban water body under the influence of a wastewater treatment plant: assessment of environmental impacts,2018,Português,SCIENTIA CUM INDUSTRIA,SEM_DADOS,SEM_DADOS,"['SCHNEIDER, V. E. and', 'MARQUES, R. V. and', 'SANTOS, M. B. and']"
LATTES,PERIODICO,9940289333509769,Vania Elisabete Schneider,10.18226/23185279.v6iss3p7,Biological assessment and metals concentration in blue shark (Prionace glauca) caught in the southeast-south coast of Brazil,2018,Português,SCIENTIA CUM INDUSTRIA,SEM_DADOS,SEM_DADOS,"['VIGNATTI, GABRIELA and', 'Schneider, Vania Elisabete and', 'POLETTO, Matheus and']"
LATTES,PERIODICO,9940289333509769,Vania Elisabete Schneider,10.18226/23185279.v6iss2p21,Estimativas de recarga aquÃ­fera com uso de filtros digitais em sub-bacias hidrogrÃ¡ficas do Sistema AquÃ­fero Serra Geral no estado do Rio Grande do Sul,2018,Português,SCIENTIA CUM INDUSTRIA,SEM_DADOS,SEM_DADOS,"['BORTOLIN, TAISON ANDERSON and', 'ROEHE REGINATO, PEDRO ANTONIO and', 'PRESOTTO, MARCO ANTONIO and', 'Schneider, Vania Elisabete and']"
LATTES,PERIODICO,9940289333509769,Vania Elisabete Schneider,10.1016/j.scitotenv2018.09.177,Microbial risk assessment in recreational freshwaters from southern Brazil,2019,Português,SCIENCE OF THE TOTAL ENVIRONMENT,SEM_DADOS,SEM_DADOS,"['GIRARDI, V. and', 'PAESI, S. and', 'TARWATER, P. M. and', 'SPILKI, F. R. and', 'MENA, C. D. and', 'ALBINO, S. M. and', 'DEMOLINER, M. and', 'GULARTE, J. S. and', 'SOUZA, F. G. and', 'RIGOTTO, C. and', 'QUEVEDO, D. M. and', 'SCHNEIDER, V. E. and']"
LATTES,PERIODICO,9940289333509769,Vania Elisabete Schneider,10.5902/2179460x36937,Sistema web para estimativa de evapotranspiração potencial por diferentes métodos,2019,Português,CIÊNCIA E NATURA,SEM_DADOS,SEM_DADOS,"['BORTOLIN, TAISON ANDERSON and', 'SANTOS, LUCAS MORAES DOS and', 'Silva, Adriano Gomes da and', 'Schneider, Vania Elisabete and']"
LATTES,PERIODICO,9940289333509769,Vania Elisabete Schneider,,O GERENCIAMENTO DE RESÍDUOS DA CONSTRUÇÃO CIVIL ORIUNDOS DA ARQUITETURA DE INTERIORES NA ÓTICA DE ARQUITETOS E URBANISTAS DE UM MUNICÍPIO BRASILEIRO,2019,Português,REVISTA AIDIS DE INGENIERÍA Y CIENCIAS AMBIENTALES,SEM_DADOS,SEM_DADOS,"['RISSI, N. S. and', 'GIMENEZ, J. R. and', 'SCHNEIDER, V. E. and']"
LATTES,PERIODICO,9940289333509769,Vania Elisabete Schneider,10.34117/bjdv5n11-005,Perdas de solo para condição da parcela de wischmeier: estimativa para diferentes tipos de solo do estado do Rio Grande do Sul,2019,Português,Brasilian Journal of Development,SEM_DADOS,SEM_DADOS,"['SCHNEIDER, V. E. and', 'BELLINASO, T. B. and']"
LATTES,PERIODICO,9940289333509769,Vania Elisabete Schneider,10.1080/00207233.2019.1704123,"ENVIRONMENTAL IMPACT OF POULTRY PRODUCTION SYSTEMS ON SURFACE WATER: MONITORING THE TAQUARI-ANTAS BASIN, SOUTHERN BRAZIL",2019,Inglês,International Journal of Environmental Studies,SEM_DADOS,SEM_DADOS,"['MARQUES, R. V. and', 'CEMIN, G. and', 'BORTOLIN, T. A. and', 'CARRA, S. H. Z. and', 'SCHNEIDER, V. E. and']"
LATTES,PERIODICO,9940289333509769,Vania Elisabete Schneider,10.19177/rgsa.v8e42019152164,"CONCENTRAÇÃO DE METAIS EM PEIXES DE DIFERENTES NÍVEIS TRÓFICOS, OCORRENTES NO RIO DAS ANTAS, RS - BRASIL",2019,Português,Revista Gestão e Sustentabilidade Ambiental,SEM_DADOS,SEM_DADOS,"['ANGHEBEN, F. M. and', 'SCHNEIDER, V. E. and', 'BACCIN, K. M. S. and', 'POLETO, M. and']"
LATTES,PERIODICO,9940289333509769,Vania Elisabete Schneider,,Occurrence of Polyomaviruses in Recreational Freshwaters from Southern Brazil,2019,Português,Biomedical Journal of Scientific &amp; Technical Research,SEM_DADOS,SEM_DADOS,"['URBANO, P. R. and', 'GIRARDI, V. and', 'LEAL, C. O. D. and', 'SCHNEIDER, V. E. and', 'PAESI, S. O. and', 'SPILKI, F. R. and', 'ROMANOA, C. M. and']"
