FONTE,TIPO,ID_LATTES,NOME,NATUREZA,TITULO,ANO,LANG,EVENTO/JOURNAL,CIDADE_EVENTO,ANO_EVENTO,AUTORES
LATTES,TRAB.EVENTO,2878943895928097,Edécio Fernando Iepsen,COMPLETO,Ferramenta para Visualização de Informações Temporais para Banco de Dados Mestre/Detalhe,2007,Português,ERBD 2007 Escola Regional de Banco de Dados,Caxias do Sul,2007,"['IEPSEN, Edécio F. and', 'Luzzardi, Paulo Roberto Gomes and', 'Loh, Stanley and']"
LATTES,TRAB.EVENTO,2878943895928097,Edécio Fernando Iepsen,COMPLETO,Persona-Algo: Personalização dos Exercícios de Algoritmos auxiliados por um Agente Afetivo,2010,Português,Anais do Simpósio Brasileiro de Informática na Educação - SBIE 2010,João Pessoa - PB,2010,"['IEPSEN, Edécio F. and', 'BERCHT, M. and', 'Reategui, E. and']"
LATTES,TRAB.EVENTO,2878943895928097,Edécio Fernando Iepsen,COMPLETO,Sistema de Recomendação de Exercícios de Algoritmos Considerando o Aspecto Afetivo Frustração do Aluno,2010,Português,Anais do Congreso Iberoamericano de Informática Educativa,Santiago - Chile,2010,"['IEPSEN, Edécio F. and', 'BERCHT, M. and', 'Reategui, E. and']"
LATTES,TRAB.EVENTO,2878943895928097,Edécio Fernando Iepsen,COMPLETO,Detectando o Estado Afetivo Frustração do Aluno na Realização de Algoritmos,2011,Português,LACLO,Montevideo - Uruguai,2011,"['IEPSEN, Edécio F. and', 'BERCHT, M. and', 'Reategui, E. and']"
LATTES,TRAB.EVENTO,2878943895928097,Edécio Fernando Iepsen,COMPLETO,Detecção e Tratamento do Estado Afetivo Frustração do Aluno na Disciplina de Algoritmos,2011,Português,22 Simpósio Brasileiro de Informática na Educação,Aracaju - SE,2011,"['IEPSEN, Edécio F. and', 'BERCHT, M. and', 'Reategui, E. and']"
LATTES,TRAB.EVENTO,2878943895928097,Edécio Fernando Iepsen,COMPLETO,Detection and Assistance to Students Who Show Frustration in Learning of Algorithms,2013,Inglês,2013 IEEE Frontiers in Education Conference,OKLAHOMA CITY,2013,"['IEPSEN, Edécio F. and', 'BERCHT, M. and', 'Reategui, E. and']"
LATTES,TRAB.EVENTO,2878943895928097,Edécio Fernando Iepsen,COMPLETO,Uma Pesquisa Sobre a Personalização dos Exercícios de Algoritmos Apoiados por um Agente Afetivo,2010,Português,Anais do Congresso Internacional de Educação a Distância da UFPel,Pelotas,2010,"['IEPSEN, Edécio F. and', 'BERCHT, M. and', 'Reategui, E. and']"
