FONTE,TIPO,ID_LATTES,NOME,NATUREZA,TITULO,ANO,LANG,EVENTO/JOURNAL,CIDADE_EVENTO,ANO_EVENTO,AUTORES
LATTES,TRAB.EVENTO,5878372087019892,Angelo Augusto Frozza,COMPLETO,M-Commerce Aplicado ao Comércio de Materiais de Construção,2000,Português,Anais III Fórum de Tecnologia,Santo Angelo/RS,2000,"['FROZZA, A. A.;FROZZA, ANGELO AUGUSTO and', 'CAMARGO, R. G. and']"
LATTES,TRAB.EVENTO,5878372087019892,Angelo Augusto Frozza,RESUMO,Curso de Extensão a Distância TV na Escola e os Desafios de Hoje,2001,Português,Anais. . .,Itajaí-SC,2001,"['FROZZA, A. A.;FROZZA, ANGELO AUGUSTO and']"
LATTES,TRAB.EVENTO,5878372087019892,Angelo Augusto Frozza,COMPLETO,Um Ambiente Colaborativo para Auxílio ao Aprendizado: Clube Virtual de Ciências,2003,Português,XXIX Conferencia Latinoamericana de Informatica - CLEI 2003,La Paz,2003,"['FROZZA, A. A.;FROZZA, ANGELO AUGUSTO and', 'BET, S. and']"
LATTES,TRAB.EVENTO,5878372087019892,Angelo Augusto Frozza,COMPLETO,Proposta para o Desenvolvimento do Banco de Desafios do Clube Virtual de Ciências Utilizando Redes Bayesianas,2003,Português,Anais . . .,Santa Maria,2003,"['FROZZA, A. A.;FROZZA, ANGELO AUGUSTO and', 'BET, S. and', 'BORGES, P. S. S. and']"
LATTES,TRAB.EVENTO,5878372087019892,Angelo Augusto Frozza,COMPLETO,Criando Ambientes Virtuais de Aprendizagem: a Experiência e Oportunidades do Clube Virtual de Ciências,2003,Português,Anais VII Mostra de Trabalhos de Iniciação à Pesquisa,Lages,2003,"['FROZZA, A. A.;FROZZA, ANGELO AUGUSTO and', 'BET, S. and']"
LATTES,TRAB.EVENTO,5878372087019892,Angelo Augusto Frozza,RESUMO,Um Estudo sobre a Aplicação do SVG (Scalable Vector Graphics) na Criação de Material Didático com Recursos Multimídia,2003,Português,Anais VII Mostra de Trabalhos e Iniciação à Pesquisa,Lages,2003,"['FROZZA, A. A.;FROZZA, ANGELO AUGUSTO and', 'MACHADO, L. de F. B. B. and', 'MONTEIRO, R. R. de O. and']"
LATTES,TRAB.EVENTO,5878372087019892,Angelo Augusto Frozza,RESUMO,Gerenciamento Eletrônico de Documentos: um estudo teórico para definição do projeto OpenGED,2002,Português,VII Mostra de Trabalhos de Iniciação à Pesquisa,Lages,2002,"['FROZZA, A. A.;FROZZA, ANGELO AUGUSTO and', 'OLIVEIRA FILHO, F. M. de and', 'SANTOS, I. F. A. dos and', 'CENCI, J. A. and']"
LATTES,TRAB.EVENTO,5878372087019892,Angelo Augusto Frozza,RESUMO,Indexação de Arquivos Textos: um Estudo de Caso para o Projeto OpenGED,2002,Português,Anais VII Mostra de Trabalhos de Iniciação à Pesquisa,Lages,2002,"['FROZZA, A. A.;FROZZA, ANGELO AUGUSTO and', 'OLIVEIRA FILHO, F. M. de and', 'SANTOS, I. F. A. dos and', 'CENCI, J. A. and']"
LATTES,TRAB.EVENTO,5878372087019892,Angelo Augusto Frozza,COMPLETO,LearnLoop: o desafio de aplicar software livre na educação a distância,2004,Português,Anais . . .,Manaus,2004,"['FROZZA, A. A.;FROZZA, ANGELO AUGUSTO and', 'LIZ, J. M. de and']"
LATTES,TRAB.EVENTO,5878372087019892,Angelo Augusto Frozza,RESUMO_EXPANDIDO,Banco de Desafios: uma aplicação de hipermídia adaptativa e redes bayesianas,2004,Português,Anais. . .,Manaus,2004,"['FROZZA, A. A.;FROZZA, ANGELO AUGUSTO and', 'BET, S. and', 'ARRUDA, A. A. C. and']"
LATTES,TRAB.EVENTO,5878372087019892,Angelo Augusto Frozza,RESUMO_EXPANDIDO,Um ambiente colaborativo para auxílio ao aprendizado: Clube Virtual de Ciências,2004,Português,Anais. . .,Manaus,2004,"['FROZZA, A. A.;FROZZA, ANGELO AUGUSTO and', 'BET, S. and', 'BONFIM, V. D. and', 'BUSNELLO, T. A. and']"
LATTES,TRAB.EVENTO,5878372087019892,Angelo Augusto Frozza,COMPLETO,Sistema de Informação Geográfica aplicado ao Programa de Assistência Odontológica da UNIPLAC - SOU,2004,Português,Anais . . .,Lages (SC),2004,"['FROZZA, A. A.;FROZZA, ANGELO AUGUSTO and', 'MONTEIRO, R. R. de O. and', 'VALIATI, R. and', 'VENTURI, S. C. and']"
LATTES,TRAB.EVENTO,5878372087019892,Angelo Augusto Frozza,RESUMO_EXPANDIDO,Um ambiente colaborativo para auxílio ao aprendizado: Clube Virtual de Ciências,2004,Português,Anais da VIII Mostra de Trabalhos e Iniciação à Pesquisa,Lages,2004,"['FROZZA, A. A.;FROZZA, ANGELO AUGUSTO and', 'BET, S. and', 'BONFIM, V. D. and', 'BUSNELLO, T. A. and']"
LATTES,TRAB.EVENTO,5878372087019892,Angelo Augusto Frozza,RESUMO_EXPANDIDO,Banco de Desafios: uma aplicação de hipermídia adaptativa e redesbayesianas,2004,Português,Anais da VIII Mostra de Trabalhos e Iniciação à Pesquisa,Lages,2004,"['FROZZA, A. A.;FROZZA, ANGELO AUGUSTO and', 'BET, S. and', 'ARRUDA, A. A. C. and']"
LATTES,TRAB.EVENTO,5878372087019892,Angelo Augusto Frozza,RESUMO,Sistema de Informação Geográfica aplicado ao Programa de Assistência Odontológica da UNIPLAC,2004,Português,Anais da VIII Mostra de Trabalhos e Iniciação à Pesquisa,Lages,2004,"['FROZZA, A. A.;FROZZA, ANGELO AUGUSTO and', 'MONTEIRO, R. R. de O. and', 'VALIATI, R. and', 'VENTURI, S. C. and', 'SOUSA, J. A. C. de and']"
LATTES,TRAB.EVENTO,5878372087019892,Angelo Augusto Frozza,COMPLETO,Uso de SIG como suporte à decisão em Programa de Assistência Odontológica,2005,Português,XIV SEMINCO,Blumenau,2005,"['FROZZA, A. A.;FROZZA, ANGELO AUGUSTO and', 'MONTEIRO, R. R. de O. and', 'SOUSA, J. A. C. de and', 'VALIATI, R. and']"
LATTES,TRAB.EVENTO,5878372087019892,Angelo Augusto Frozza,COMPLETO,Determinando equivalências semânticas entre componentes de Esquemas GML,2006,Português,"Escola Regional de Banco de Dados, 2.",Passo Fundo,2006,"['FROZZA, A. A.;FROZZA, ANGELO AUGUSTO and', 'MELLO, R. dos S. and']"
LATTES,TRAB.EVENTO,5878372087019892,Angelo Augusto Frozza,COMPLETO,Um Método para Determinar a Equivalência Semântica entre Esquemas GML,2006,Afrikaans,"Simpósio Brasileiro de Geoinformática, 8.",Campos do Jordão,2006,"['FROZZA, A. A.;FROZZA, ANGELO AUGUSTO and', 'MELLO, R. dos S. and']"
LATTES,TRAB.EVENTO,5878372087019892,Angelo Augusto Frozza,COMPLETO,Uma Ferramenta de Apoio à Determinação de Equivalências Semânticas entre Esquemas GML,2007,Português,Anais...,Caxias do Sul,2007,"['ROSA, L. and', 'FROZZA, A. A.;FROZZA, ANGELO AUGUSTO and', 'MELLO, R. dos S. and']"
LATTES,TRAB.EVENTO,5878372087019892,Angelo Augusto Frozza,COMPLETO,Um Protótipo para Geração de Imagens Utilizando Ray Tracing,1994,Português,Anais...,Blumenau,1994,"['FROZZA, A. A.;FROZZA, ANGELO AUGUSTO and', 'OLIVEIRA NETO, M. M. and']"
LATTES,TRAB.EVENTO,5878372087019892,Angelo Augusto Frozza,COMPLETO,A Internet e os Novos Modelos de Negócios: Empresas Virtuais x Incubadora Virtual,2000,Português,Anais...,São Paulo,2000,"['FROZZA, A. A.;FROZZA, ANGELO AUGUSTO and', 'FIOD NETO, M. and']"
LATTES,TRAB.EVENTO,5878372087019892,Angelo Augusto Frozza,COMPLETO,Uma Proposta de Rede Relacional de Empresas: Cooperativa de Abastecimento para uma Usina de Reciclagem de Borracha,1999,Português,Anais...,Rio de Janeiro,1999,"['FROZZA, A. A.;FROZZA, ANGELO AUGUSTO and', 'CASAROTTO FILHO, N. and']"
LATTES,TRAB.EVENTO,5878372087019892,Angelo Augusto Frozza,RESUMO_EXPANDIDO,Clube Virtual de Ciências,2002,Português,Anais...,São Leopoldo,2002,"['FROZZA, A. A.;FROZZA, ANGELO AUGUSTO and', 'BET, S. and']"
LATTES,TRAB.EVENTO,5878372087019892,Angelo Augusto Frozza,RESUMO_EXPANDIDO,FadesGML - Ferramenta para Determinação de Equivalências Semânticas entre Elementos de Esquemas GML,2008,Português,"Simpósio Brasileiro de Banco de Dados, 23.",Campinas,2008,"['FROZZA, A. A.;FROZZA, ANGELO AUGUSTO and', 'MELLO, R. dos S. and']"
LATTES,TRAB.EVENTO,5878372087019892,Angelo Augusto Frozza,COMPLETO,Middleware para integração de uma aplicação para dispositivos móveis com aplicações corporativas,2009,Português,Anais...,Blumenau,2009,"['COMEL, T. and', 'FROZZA, A. A.;FROZZA, ANGELO AUGUSTO and']"
LATTES,TRAB.EVENTO,5878372087019892,Angelo Augusto Frozza,RESUMO_EXPANDIDO,Uma Ferramenta para gerar Bancos de Dados Geográficos a partir de Diagramas OMT-G,2010,Português,Anais...,Joinville,2010,"['SCHALY, K. W. and', 'FROZZA, A. A.;FROZZA, ANGELO AUGUSTO and']"
LATTES,TRAB.EVENTO,5878372087019892,Angelo Augusto Frozza,COMPLETO,Implantação da metodologia Balanced Score Card nas empresas incubadas no MIDILages,2010,Português,Anais...,Campo Grande (MS),2010,"['LIZ, C. E. de and', 'FROZZA, A. A.;FROZZA, ANGELO AUGUSTO and', 'MAGNABOSCO, R. and']"
LATTES,TRAB.EVENTO,5878372087019892,Angelo Augusto Frozza,RESUMO_EXPANDIDO,PostgreSQL x MongoDB: comparação dos recursos para manipulação de dados geográficos,2012,Português,Anais da V Mostra Nacional de Iniciação Científica e Tecnológica Interdisciplinar (V MICTI) e II Mostra de Pesquisa e Extensão do IF Catarinense,Rio do Sul,2012,"['SCHUCH, E. M. and', 'CATARINA, G. O. B. and', 'FROZZA, A. A.;FROZZA, ANGELO AUGUSTO and']"
LATTES,TRAB.EVENTO,5878372087019892,Angelo Augusto Frozza,RESUMO_EXPANDIDO,OMT-G Design: Ferramenta para modelagem de Bancos de Dados Geográficos usando OMT-G,2012,Português,Anais da V Mostra Nacional de Iniciação Científica e Tecnológica Interdisciplinar (V MICTI) e II Mostra de Pesquisa e Extensão do IF Catarinense,Rio do Sul,2012,"['MARTINEZ, Á. O. T. and', 'FROZZA, A. A.;FROZZA, ANGELO AUGUSTO and']"
LATTES,TRAB.EVENTO,5878372087019892,Angelo Augusto Frozza,RESUMO_EXPANDIDO,Levantamento de requisitos para um sistema de acompanhamento de egressos,2013,Português,Anais...,Camboriú,2013,"['KOEHLER, M. D. and', 'FROZZA, A. A.;FROZZA, ANGELO AUGUSTO and']"
LATTES,TRAB.EVENTO,5878372087019892,Angelo Augusto Frozza,RESUMO_EXPANDIDO,Lixo eletrônico: origens e reaproveitamento,2013,Português,Anais...,Camboriú,2013,"['SANTOS, M. F. F. and', 'LUCENA, J. H. B. A. and', 'FROZZA, A. A.;FROZZA, ANGELO AUGUSTO and']"
LATTES,TRAB.EVENTO,5878372087019892,Angelo Augusto Frozza,RESUMO_EXPANDIDO,Software Educacional para cálculo da projeção de sombras de objetos iluminados pelo sol,2013,Português,Anais...,Camboriú,2013,"['CAMPOS, L. G. and', 'CANDIDO, G. and', 'FROZZA, A. A.;FROZZA, ANGELO AUGUSTO and']"
LATTES,TRAB.EVENTO,5878372087019892,Angelo Augusto Frozza,RESUMO,"Rede social colaborativa de mapeamento de problemas ambientais, de infraestrutura urbana e desastres, para geração de informação ao poder público",2014,Português,Anais...,Rio do Sul - SC,2014,"['SILVA, S. H. and', 'FROZZA, A. A.;FROZZA, ANGELO AUGUSTO and']"
LATTES,TRAB.EVENTO,5878372087019892,Angelo Augusto Frozza,COMPLETO,Armazenamento de trajetórias de objetos móveis para a Plataforma UrbanMob,2014,Português,Anais...,São Francisco do Sul - SC,2014,"['MEIRELES, G. C. and', 'FROZZA, A. A.;FROZZA, ANGELO AUGUSTO and']"
LATTES,TRAB.EVENTO,5878372087019892,Angelo Augusto Frozza,COMPLETO,OMT-G Design: uma ferramenta para modelagem de dados espaciais,2014,Português,Anais...,São Francisco do Sul - SC,2014,"['MARTINEZ, Á. O. T. and', 'FROZZA, A. A.;FROZZA, ANGELO AUGUSTO and']"
LATTES,TRAB.EVENTO,5878372087019892,Angelo Augusto Frozza,COMPLETO,Sistema de Informação para monitoramento de qualidade da água e apoio ao enquadramento de corpos hídricos,2014,Português,Anais...,Londrina - PR,2014,"['SILVA, R. R. da and', 'FROZZA, A. A.;FROZZA, ANGELO AUGUSTO and']"
LATTES,TRAB.EVENTO,5878372087019892,Angelo Augusto Frozza,COMPLETO,"Astronomia, sombras e outros conhecimentos científicos no Ensino Médio",2014,Português,Anais...,Brasília - DF,2014,"['CANDIDO, G. and', 'CAMPOS, L. G. and', 'FROZZA, A. A.;FROZZA, ANGELO AUGUSTO and']"
LATTES,TRAB.EVENTO,5878372087019892,Angelo Augusto Frozza,RESUMO_EXPANDIDO,Rede Social de Mapeamento Colaborativo de Problemas Ambientais e Urbanos nas Cidades - Pesquisa em Andamento: resultados preliminares,2014,Português,Anais...,Camboriú,2014,"['SILVA, S. H. and', 'FROZZA, A. A.;FROZZA, ANGELO AUGUSTO and', 'SILVA, R. R. da and']"
LATTES,TRAB.EVENTO,5878372087019892,Angelo Augusto Frozza,RESUMO_EXPANDIDO,Sistema para controle de egressos e indicadores de medição: pesquisa em andamento - resultados preliminares,2014,Português,Anais...,Camboriú,2014,"['BASTOS, N. S. and', 'FROZZA, A. A.;FROZZA, ANGELO AUGUSTO and', 'SILVA, R. R. da and']"
LATTES,TRAB.EVENTO,5878372087019892,Angelo Augusto Frozza,RESUMO_EXPANDIDO,TwitKnowledge - Obtendo conhecimento a partir dos twittes pessoais,2014,Português,Anais...,Camboriú,2014,"['FRANTZ, M. A. and', 'FROZZA, A. A.;FROZZA, ANGELO AUGUSTO and']"
LATTES,TRAB.EVENTO,5878372087019892,Angelo Augusto Frozza,RESUMO_EXPANDIDO,Ambiente Virtual de Apoio ao Aluno - Pesquisa em andamento: resultados preliminares,2014,Português,Anais...,Camboriú,2014,"['PAES, D. L. and', 'FROZZA, A. A.;FROZZA, ANGELO AUGUSTO and']"
LATTES,TRAB.EVENTO,5878372087019892,Angelo Augusto Frozza,RESUMO_EXPANDIDO,Disseminando o conhecimento científico produzido no IFC - Extensão em andamento: resultados preliminares,2014,Português,Anais...,Camboriú,2014,"['REICHERT, D. R. and', 'FROZZA, A. A.;FROZZA, ANGELO AUGUSTO and']"
LATTES,TRAB.EVENTO,5878372087019892,Angelo Augusto Frozza,RESUMO_EXPANDIDO,"Astronomia, sombras e outros conhecimentos",2014,Português,Anais...,Camboriú,2014,"['CAMPOS, L. G. and', 'CANDIDO, G. and', 'FROZZA, A. A.;FROZZA, ANGELO AUGUSTO and']"
LATTES,TRAB.EVENTO,5878372087019892,Angelo Augusto Frozza,RESUMO_EXPANDIDO,Lógica e robótica,2014,Português,Anais...,Camboriú,2014,"['LUCENA, J. H. B. A. and', 'FROZZA, A. A.;FROZZA, ANGELO AUGUSTO and']"
LATTES,TRAB.EVENTO,5878372087019892,Angelo Augusto Frozza,RESUMO_EXPANDIDO,Lixo eletrônico - Wiki e-Lixo: origens e reaproveitamento,2014,Português,Anais...,Camboriú,2014,"['SANTOS, M. F. F. and', 'FROZZA, A. A.;FROZZA, ANGELO AUGUSTO and']"
LATTES,TRAB.EVENTO,5878372087019892,Angelo Augusto Frozza,RESUMO_EXPANDIDO,Aplicação web para apoio ao reconhecimento fotográfico de suspeitos de crimes,2014,Português,Anais...,Camboriú,2014,"['PROVESI, M. and', 'SILVA, R. R. da and', 'FROZZA, A. A.;FROZZA, ANGELO AUGUSTO and']"
LATTES,TRAB.EVENTO,5878372087019892,Angelo Augusto Frozza,RESUMO_EXPANDIDO,Plataforma UrbanMob: aplicativo para captura de trajetórias urbanas de objetos móveis,2014,Português,Anais...,Camboriú,2014,"['GAMA, G. G. and', 'SILVA, R. R. da and', 'FROZZA, A. A.;FROZZA, ANGELO AUGUSTO and']"
LATTES,TRAB.EVENTO,5878372087019892,Angelo Augusto Frozza,RESUMO_EXPANDIDO,Estuda das possibilidades metodológicas de um programa de orientação profissional no ensino médio integrado do IFC-Camboriú,2014,Português,Anais...,Camboriú,2014,"['PALOMBO, J. L. and', 'VERIGUINE, N. R. and', 'FROZZA, A. A.;FROZZA, ANGELO AUGUSTO and']"
LATTES,TRAB.EVENTO,5878372087019892,Angelo Augusto Frozza,RESUMO_EXPANDIDO,Sistema Inteligente para Apoio a Identificação de Possíveis Suspeitos - Reengenharia e Evolução da Aplicação,2015,Português,Anais...,Camboriú,2015,"['SILVA, R. R. da and', 'PROVESI, M. and', 'FROZZA, A. A.;FROZZA, ANGELO AUGUSTO and']"
LATTES,TRAB.EVENTO,5878372087019892,Angelo Augusto Frozza,RESUMO_EXPANDIDO,Estudo das possibilidades metodológicas de um programa de orientação profissional no ensino médio integrado do IFC-CC,2015,Português,Anais...,Camboriú,2015,"['PALOMBO, J. L. and', 'VERIGUINE, N. R. and', 'FROZZA, A. A.;FROZZA, ANGELO AUGUSTO and']"
LATTES,TRAB.EVENTO,5878372087019892,Angelo Augusto Frozza,RESUMO_EXPANDIDO,Aplicativo mobile para encaminhamento do descarte correto de resíduos recicláveis em postos destinados à coleta,2015,Português,Anais...,Camboriú,2015,"['TELES, L. T. and', 'FROZZA, A. A.;FROZZA, ANGELO AUGUSTO and']"
LATTES,TRAB.EVENTO,5878372087019892,Angelo Augusto Frozza,RESUMO_EXPANDIDO,Aplicativo para comunicação de alertas e avisos sobre riscos e desastres utilizando push notification,2015,Português,Anais...,Camboriú,2015,"['PROVESI, M. and', 'FROZZA, A. A.;FROZZA, ANGELO AUGUSTO and', 'SILVA, R. R. da and']"
LATTES,TRAB.EVENTO,5878372087019892,Angelo Augusto Frozza,RESUMO_EXPANDIDO,Como vai a câmara? Uma proposta de uso de dados abertos,2015,Português,Anais...,Camboriú,2015,"['VARGAS, D. A. and', 'FROZZA, A. A.;FROZZA, ANGELO AUGUSTO and']"
LATTES,TRAB.EVENTO,5878372087019892,Angelo Augusto Frozza,RESUMO_EXPANDIDO,Conhecimento em redes sociais: um estudo relacionado à recuperação de informação sobre textos publicados no Twitter,2015,Português,Anais...,Camboriú,2015,"['FRANTZ, M. A. and', 'FROZZA, A. A.;FROZZA, ANGELO AUGUSTO and', 'SILVA, R. R. da and']"
LATTES,TRAB.EVENTO,5878372087019892,Angelo Augusto Frozza,RESUMO_EXPANDIDO,Proposta de uma aplicação para controle de Fluxo de Caixa para o Microempreendedor Individual - MEI,2015,Português,Anais...,Camboriú,2015,"['SILVA, J. M. da and', 'FROZZA, A. A.;FROZZA, ANGELO AUGUSTO and']"
LATTES,TRAB.EVENTO,5878372087019892,Angelo Augusto Frozza,RESUMO_EXPANDIDO,Proposta do portal de egressos para o IFC-Camboriú,2015,Português,Anais...,Camboriú,2015,"['REICHERT, D. R. and', 'FROZZA, A. A.;FROZZA, ANGELO AUGUSTO and', 'SILVA, R. R. da and']"
LATTES,TRAB.EVENTO,5878372087019892,Angelo Augusto Frozza,RESUMO_EXPANDIDO,Observatório do Mercado de Trabalho: Sistema de Acompanhamento de Egressos no IFC ? Câmpus Camboriú,2015,Português,Anais...,Rio do Sul,2015,"['REICHERT, D. R. and', 'FROZZA, A. A.;FROZZA, ANGELO AUGUSTO and', 'SILVA, R. R. da and']"
LATTES,TRAB.EVENTO,5878372087019892,Angelo Augusto Frozza,RESUMO_EXPANDIDO,"JSON: Caracteri&amp;#769;sticas, comparac&amp;#807;o&amp;#771;es e implementac&amp;#807;a&amp;#771;o de um estudo de caso",2015,Português,Anais...,Rio do Sul,2015,"['KREBS, J. J. and', 'TELES, L. T. and', 'FROZZA, A. A.;FROZZA, ANGELO AUGUSTO and']"
LATTES,TRAB.EVENTO,5878372087019892,Angelo Augusto Frozza,RESUMO_EXPANDIDO,Tweetknowledge ? Obtendo conhecimento a partir dos tweets pessoais,2015,Português,Anais...,Rio do Sul,2015,"['FRANTZ, M. A. and', 'FROZZA, A. A.;FROZZA, ANGELO AUGUSTO and', 'SILVA, R. R. da and']"
LATTES,TRAB.EVENTO,5878372087019892,Angelo Augusto Frozza,RESUMO_EXPANDIDO,Sistema de comunicação de alertas e avisos para gestão de riscos e desastres utilizando o serviço Google Cloud Messaging,2015,Português,Anais...,Rio do Sul,2015,"['PROVESI, M. and', 'FROZZA, A. A.;FROZZA, ANGELO AUGUSTO and', 'SILVA, R. R. da and']"
LATTES,TRAB.EVENTO,5878372087019892,Angelo Augusto Frozza,RESUMO_EXPANDIDO,COMO VAI A CÂMARA? Uma proposta de uso de dados abertos,2015,Português,Anais ...,Sombrio (SC),2015,"['VARGAS, D. A. and', 'FROZZA, A. A.;FROZZA, ANGELO AUGUSTO and']"
LATTES,TRAB.EVENTO,5878372087019892,Angelo Augusto Frozza,RESUMO_EXPANDIDO,ESTUDO SOBRE A TECNOLOGIA DE BANCO DE DADOS NoSQL,2015,Português,Anais...,Sombrio (SC),2015,"['RYBERG, N. I. and', 'FROZZA, A. A.;FROZZA, ANGELO AUGUSTO and']"
LATTES,TRAB.EVENTO,5878372087019892,Angelo Augusto Frozza,RESUMO_EXPANDIDO,PORTAL DO EGRESSO DO IFC ? CAMPUS CAMBORIU&amp;#769;,2015,Português,Anais...,Sombrio (SC),2015,"['HILLESHEIM, R. R. E. and', 'FROZZA, A. A.;FROZZA, ANGELO AUGUSTO and', 'REICHERT, D. R. and', 'SILVA, R. R. da and']"
LATTES,TRAB.EVENTO,5878372087019892,Angelo Augusto Frozza,RESUMO_EXPANDIDO,RECUPERANDO INFORMAC&amp;#807;A&amp;#771;O SOBRE TEXTOS PUBLICADOS NO TWITTER,2015,Português,Anais...,Sombrio (SC),2015,"['FRANTZ, M. A. and', 'FROZZA, A. A.;FROZZA, ANGELO AUGUSTO and', 'SILVA, R. R. da and']"
LATTES,TRAB.EVENTO,5878372087019892,Angelo Augusto Frozza,RESUMO_EXPANDIDO,Portal do Egresso do IFC ? Campus Camboriu&amp;#769;,2016,Português,Anais...,Florianópolis,2016,"['HILLESHEIM, R. R. E. and', 'FROZZA, A. A.;FROZZA, ANGELO AUGUSTO and', 'SILVA, R. R. da and']"
LATTES,TRAB.EVENTO,5878372087019892,Angelo Augusto Frozza,RESUMO_EXPANDIDO,Arquitetura de software sensi&amp;#769;vel ao contexto para busca de imo&amp;#769;veis,2016,Português,Anais...,Florianópolis,2016,"['OLIVEIRA, P. G. D. de and', 'FROZZA, A. A.;FROZZA, ANGELO AUGUSTO and']"
LATTES,TRAB.EVENTO,5878372087019892,Angelo Augusto Frozza,RESUMO_EXPANDIDO,Proposta de um sistema de informação aplicado ao gerenciamento de Trabalhos de Conclusão de curso do IFC-Campus Camboriu,2016,Bretão,Anais...,Camboriú,2016,"['MASO, L. and', 'SCHMIDT, A. E. F. and', 'FROZZA, A. A.;FROZZA, ANGELO AUGUSTO and']"
LATTES,TRAB.EVENTO,5878372087019892,Angelo Augusto Frozza,RESUMO_EXPANDIDO,Coleta e armazenamento de trajetórias: um estudo de caso aplicado ao processo de socialização de cães-guia,2016,Bretão,Anais...,Camboriú,2016,"['FRANTZ, M. A. and', 'FROZZA, A. A.;FROZZA, ANGELO AUGUSTO and', 'VARELA, D. A. and', 'HILLESHEIM, R. R. E. and']"
LATTES,TRAB.EVENTO,5878372087019892,Angelo Augusto Frozza,RESUMO_EXPANDIDO,Comparação entre o desenvolvimento de aplicações web com banco de dados tradicional e banco de dados NoSQL MongoDB,2016,Bretão,Anais...,Camboriú,2016,"['RYBERG, N. I. and', 'FROZZA, A. A.;FROZZA, ANGELO AUGUSTO and', 'VARELA, D. A. and']"
LATTES,TRAB.EVENTO,5878372087019892,Angelo Augusto Frozza,RESUMO_EXPANDIDO,Análise de trajetórias aplicada ao processo de socialização de cães-guia,2016,Português,Anais...,Videira,2016,"['HILLESHEIM, R. R. E. and', 'FROZZA, A. A.;FROZZA, ANGELO AUGUSTO and', 'VARELA, D. A. and']"
LATTES,TRAB.EVENTO,5878372087019892,Angelo Augusto Frozza,RESUMO_EXPANDIDO,Modelagem de um sistema de informação aplicado ao gerenciamento do acompanhamento de Trabalhos de Conclusão de curso do IFC-Campus Camboriú,2016,Português,Anais...,Videira,2016,"['MASO, L. and', 'SCHMIDT, A. E. F. and', 'FROZZA, A. A.;FROZZA, ANGELO AUGUSTO and']"
LATTES,TRAB.EVENTO,5878372087019892,Angelo Augusto Frozza,RESUMO_EXPANDIDO,Coleta e armazenamento de trajeto&amp;#769;rias: um estudo de caso aplicado ao processo de socializac&amp;#807;a&amp;#771;o de ca&amp;#771;es-guia,2016,Português,Anais...,Videira,2016,"['FRANTZ, M. A. and', 'FROZZA, A. A.;FROZZA, ANGELO AUGUSTO and', 'VARELA, D. A. and']"
LATTES,TRAB.EVENTO,5878372087019892,Angelo Augusto Frozza,RESUMO_EXPANDIDO,Diferenças no desenvolvimento de aplicações web com BD tradicional e BD NoSQL MongoDB,2016,Português,Anais...,Videira,2016,"['RYBERG, N. I. and', 'FROZZA, A. A.;FROZZA, ANGELO AUGUSTO and', 'VARELA, D. A. and']"
LATTES,TRAB.EVENTO,5878372087019892,Angelo Augusto Frozza,COMPLETO,Conhecimento em redes sociais: um estudo de caso aplicado ao Twitter,2016,Português,Anais do XXXVI congresso da sociedade brasileira de computac&amp;#807;a&amp;#771;o : #Computac&amp;#807;a&amp;#771;oeinterdisciplinaridade,Porto Alegre,2016,"['FRANTZ, M. A. and', 'FROZZA, A. A.;FROZZA, ANGELO AUGUSTO and', 'SILVA, R. R. da and']"
LATTES,TRAB.EVENTO,5878372087019892,Angelo Augusto Frozza,RESUMO_EXPANDIDO,Aplicação Web para Apoio ao Reconhecimento Fotográfico de Possíveis Suspeitos de Crimes,2014,Português,Anais...,Criciúma,2014,"['PROVESI, M. and', 'SILVA, R. R. da and', 'FROZZA, A. A.;FROZZA, ANGELO AUGUSTO and']"
LATTES,TRAB.EVENTO,5878372087019892,Angelo Augusto Frozza,COMPLETO,Análise de Trajetórias aplicada ao Processo de Socialização de Cães-Guia,2016,Português,Anais...,Criciúma,2016,"['HILLESHEIM, R. R. E. and', 'FROZZA, A. A.;FROZZA, ANGELO AUGUSTO and', 'VARELA, D. A. and']"
LATTES,TRAB.EVENTO,5878372087019892,Angelo Augusto Frozza,COMPLETO,Coleta e armazenamento de trajetórias: um estudo de caso aplicado ao processo de socialização de cães-guia,2016,Português,Anais...,Criciúma,2016,"['FRANTZ, M. A. and', 'FROZZA, A. A.;FROZZA, ANGELO AUGUSTO and', 'VARELA, D. A. and']"
LATTES,TRAB.EVENTO,5878372087019892,Angelo Augusto Frozza,COMPLETO,Um Survey sobre Extrac&amp;#807;a&amp;#771;o de Esquemas de Documentos JSON,2017,Português,Anais...,Passo Fundo,2017,"['FROZZA, A. A.;FROZZA, ANGELO AUGUSTO and', 'IMHOF, R. and', 'MELLO, R. dos S. and']"
LATTES,TRAB.EVENTO,5878372087019892,Angelo Augusto Frozza,COMPLETO,Uma aplicac&amp;#807;a&amp;#771;o de coleta e armazenamento de trajeto&amp;#769;rias,2017,Português,Anais...,Florianópolis,2017,"['FROZZA, A. A.;FROZZA, ANGELO AUGUSTO and', 'FRANTZ, M. A. and', 'VARELA, D. A. and']"
LATTES,TRAB.EVENTO,5878372087019892,Angelo Augusto Frozza,COMPLETO,DINo: uma ferramenta para importação de dados em bancos de dados NoSQL,2018,Português,Anais...,Rio Grande (RS),2018,"['FROZZA, A. A.;FROZZA, ANGELO AUGUSTO and', 'SCHREINER, G. and', 'BRUGGEMANN, R. and', 'MELLO, R. dos S. and']"
LATTES,TRAB.EVENTO,5878372087019892,Angelo Augusto Frozza,COMPLETO,An Approach for Schema Extraction of JSON and Extended JSON Document Collections,2018,Inglês,2018 IEEE International Conference on Information Reuse and Integration (IRI),Salt Lake City,2018,"['FROZZA, ANGELO AUGUSTO and', 'MELLO, RONALDO DOS SANTOS and', 'COSTA, FELIPE DE SOUZA DA and']"
LATTES,TRAB.EVENTO,5878372087019892,Angelo Augusto Frozza,COMPLETO,A Process for Reverse Engineering of Aggregate-Oriented NoSQL Databases with Emphasis on Geographic Data,2018,Português,33rd Annual Brazilian Symposium on Databases: Proceeedings Companion,Rio de Janeiro (RJ),2018,"['FROZZA, A. A. and', 'MELLO, R. dos S. and']"
LATTES,TRAB.EVENTO,5878372087019892,Angelo Augusto Frozza,COMPLETO,REx - NoSQL Redis Schema Extraction Module,2019,Português,Anais...,Chapecó (SC),2019,"['FROZZA, ANGELO AUGUSTO and', 'SCHREINER, G. and', 'MACHADO, B. R. L. and', 'MELLO, R. dos S. and']"
LATTES,TRAB.EVENTO,5878372087019892,Angelo Augusto Frozza,COMPLETO,Uma Análise de Soluções NewSQL,2019,Português,Anais...,Chapecó (SC),2019,"['KNOB, R. R. and', 'SCHREINER, G. and', 'FROZZA, ANGELO AUGUSTO and', 'MELLO, R. dos S. and']"
LATTES,TRAB.EVENTO,5878372087019892,Angelo Augusto Frozza,RESUMO_EXPANDIDO,Uma pesquisa sobre orientação profissional no IFC-Câmpus Camboriú,2015,Português,Anais...,Sombrio (SC),2015,"['PALOMBO, J. L. and', 'FROZZA, A. A.;FROZZA, ANGELO AUGUSTO and', 'VERIGUINE, N. R. and']"
